Channel_id,Title,Channel_name,Publish
1,Ih amis 🤣 #Shorts,Putih Abu-Abu,4 days ago
2,SHIN TAE-YONG - EXCLUSIVE DI CLOSETHEDOOR - Deddy Corbuzier Podcast,Deddy Corbuzier,5 days ago
3,"Soal Tendang Sesajen, Ini Kata Abi Quraish Shihab | Shihab & Shihab",Najwa Shihab,2 days ago
4,PRIVILEGE MENJADI GOOD LOOKING,CloseTheDoor Clips,2 days ago
5,KAKAK BERADIK PODCAST (LIVE 2 JAM) - DARI RUMAH SAKIT DIATAS TANAH KUBURAN,MOP Channel,Streamed 2 days ago
6,NOAH - Bintang di Surga (Official Music Video),NOAH OFFICIAL,9 days ago
7,Fernandes scores brace in Villa Park draw | Aston Villa 2-2 Manchester United | Premier League,Manchester United,13 hours ago
8,"INFO BMKG: Gempa Bumi 6,7 SR Guncang Jakarta dan Banten Sore Ini Jumat (14/1/2022)",HARIAN SURYA,2 days ago
9,Back 4 Blood - Game Zombie Perusak Persahabatan,MILYHYA,2 days ago
10,Aku VS Emak ketika bikin susu panas | fikrifadlu,FIKRI Production,7 days ago
11,Lesti - Lentera | Official Music Video,3D Entertainment,7 days ago
12,More fun experiments than ever 🙄🙄 #ThatLittlePuff #catsoftiktok #boostofhope #puffknowsbetter,That Little Puff,7 days ago
13,어? 네가 전학생이구나?🏫💚 | Somethinc Behind the Scene,NCT DREAM,1 day ago
14,FERDINAND DITAHAN BENARKAH DITUMBALKAN?!,Indonesia Lawyers Club,1 day ago
15,ARVIAN DWI FT. TRI SUAKA - MELEPAS LAJANG (OFFICIAL MUSIC VIDEO),TRISNA MUSIC,10 days ago
16,"TAEYONG, JENO, HENDERY, YANGYANG, GISELLE 'ZOO' Stage Video",SMTOWN,2 days ago
17,Gong!! Kiky Suca Bingung!! Raffi Ahmad Aib Aja Bisa Jadi Adsense | Konser Raya 27 Tahun Indosiar,Indosiar,4 days ago
18,One Piece Episode 1006 Sub Indo Terbaru PENUH FULL - One Piece Latest Episode,mosalsalalrayan,8 hours ago
19,Kick Andy: Mengapa Boikot Nikita Mirzani ?,metrotvnews,6 days ago
20,Cerita putri duyung! - Saya memiliki Kekuatan Putri Duyung | Koleksi Ajaib Besar oleh FUN2U,FUN2U - Indonesian,3 days ago
21,Debat Panas! Pelapor Gibran & Kaesang VS Eko Kuntadhi - ROSI,KOMPASTV,2 days ago
22,KUNGFU TEH BUNGA & KEPITING SINGAPOREAN SAUCE,Ria SW,2 days ago
23,ENHYPEN (엔하이픈) 'Blessed-Cursed' Official MV,HYBE LABELS,6 days ago
24,HIGHLIGHTS | FC Barcelona 2-3 Real Madrid | El Clásico!,Real Madrid,3 days ago
25,"Duel Maut Terekam CCTV, Korban Tewas di Lokasi Kejadian #Gerebek 13/01",Buletin iNews,2 days ago
26,BETRAND PETO PUTRA ONSU & SARWENDAH - JANGAN DENGAR MEREKA ( OFFICIAL MUSIC VIDEO ),MOP Music Channel,1 day ago
27,PANTASKAH BAHAR BIN SMITH DIPENJARA?!,Indonesia Lawyers Club,8 days ago
28,"SING-OFF TIKTOK SONGS PART 7 ""Purple Raincoat"" vs Ghea Indrawari",RZD,5 days ago
29,İnteresting Great Treasure❗️,Arkeolog,2 weeks ago
30,MAKEOVER KAMAR EKSTREM || Ide-Ide Dekor DIY Fantastis | Tutorial & Trik Parenting Keren oleh 123 GO!,123 GO! Indonesian,1 day ago
